{"conformance_fixture_artifacts":[{"artifact_digest":"sha256:eca715c40e840eb13b2dd862ecf174a3773f1b4661a1aa3c1ded41e4551c6b1e","media_type":"application/vnd.spicy.bundle-tree+json","name":"release-records/fixtures/document-release-v2/valid"},{"artifact_digest":"sha256:36fea93ea9d10a839787db84c16709d87288cf0badcb8256441f4f40a6348bb1","media_type":"application/vnd.spicy.bundle-tree+json","name":"release-records/fixtures/document-release-v2/invalid/noncanonical-root"},{"artifact_digest":"sha256:64bd4a2e288940b15fac12b56d377dd19fc0f8dc2001ae6c5bdc5c637c3e47d6","media_type":"application/vnd.spicy.bundle-tree+json","name":"release-records/fixtures/document-release-v2/invalid/unknown-version"},{"artifact_digest":"sha256:6249587feb16c5fae9c30f2fb51c0898b728bfeab2c0828d6a787910e77cb4ed","media_type":"application/vnd.spicy.bundle-tree+json","name":"release-records/fixtures/document-release-v2/invalid/wrong-identity"},{"artifact_digest":"sha256:efc004c1a3c3fa8d677debbd926056770941157d9a6423b5c97f18400ce3c494","media_type":"application/vnd.spicy.bundle-tree+json","name":"release-records/fixtures/document-release-v2/invalid/unsafe-path"},{"artifact_digest":"sha256:a4c394c05e893eb0fba8355eb4ad55eb193746bdf0ac7ebe60fa016813ab9407","media_type":"application/vnd.spicy.bundle-tree+json","name":"release-records/fixtures/document-release-v2/invalid/missing-member"},{"artifact_digest":"sha256:d1151b4fa3759b8cc523a948882308c11149a12c56016f2cde4dfbabf41cf184","media_type":"application/vnd.spicy.bundle-tree+json","name":"release-records/fixtures/document-release-v2/invalid/extra-member"},{"artifact_digest":"sha256:ccee8337ed65dcbfd03eeb521db6d942f0afb51de4da437466974da7c93c792c","media_type":"application/vnd.spicy.bundle-tree+json","name":"release-records/fixtures/document-release-v2/invalid/member-digest"},{"artifact_digest":"sha256:7678fb52d35a686d9a2456c2d8af4418573a4538ddacff9aec0fe14b3b0c23d2","media_type":"application/vnd.spicy.bundle-tree+json","name":"release-records/fixtures/document-release-v2/invalid/unknown-node-kind"},{"artifact_digest":"sha256:3c2ffccbe16b001ddfd86e099386f942869bd37e0dc8d76ef41eb6cf38cde33a","media_type":"application/vnd.spicy.bundle-tree+json","name":"release-records/fixtures/document-release-v2/invalid/duplicate-segment"},{"artifact_digest":"sha256:5099b0761c4649ab6d753fa4d491582d0f63734ca06ffaf397e2927ccc3380c1","media_type":"application/vnd.spicy.bundle-tree+json","name":"release-records/fixtures/document-release-v2/invalid/catalog-pin-mismatch"},{"artifact_digest":"sha256:24247396eb4e32821abfee815ce63989c77327d5ce885db88fc82fcb0d520f1a","media_type":"application/vnd.spicy.bundle-tree+json","name":"release-records/fixtures/document-release-v2/invalid/missing-projection-reason"},{"artifact_digest":"sha256:b1220dd378c8b077d7d5857d8ad4f5d4887bec121c5dd30156711360eea2b3d7","media_type":"application/vnd.spicy.bundle-tree+json","name":"release-records/fixtures/document-release-v2/invalid/expected-digest-mismatch"},{"artifact_digest":"sha256:03020e1132726f15bd66f98c618fc962c4cb6a111965bccc84044b3068f82904","media_type":"application/vnd.spicy.bundle-tree+json","name":"release-records/fixtures/document-release-v2/invalid/representation-bytes-differ"},{"artifact_digest":"sha256:52b6c94db02084fd5c80e7bccd9f59c2eb96e8fbd90ef0fa155143d441f9370e","media_type":"application/vnd.spicy.bundle-tree+json","name":"release-records/fixtures/document-release-v2/invalid/orphan-structural-parent"},{"artifact_digest":"sha256:0dda7bcf286020d595139543c9fb2f34c208a35b25040db2e2f23ec5d737cf80","media_type":"application/vnd.spicy.bundle-tree+json","name":"release-records/fixtures/document-release-v2/invalid/segment-heading-path"},{"artifact_digest":"sha256:512324badc2c5fde6593eee6b049a0b11a7a77e3c57ebd3c9326b4e8b93cab63","media_type":"application/vnd.spicy.bundle-tree+json","name":"release-records/fixtures/document-release-v2/invalid/coverage-gap"},{"artifact_digest":"sha256:49a10ada64e05cf672775e3d45e052957444c2d447d33d5ca0f9291809335b39","media_type":"application/vnd.spicy.bundle-tree+json","name":"release-records/fixtures/document-release-v2/invalid/join-not-one-to-one"},{"artifact_digest":"sha256:abdf4ce5c93fbd9c0613e6a4bf84fe25daff6e2f0e6d6532ae19085ecabd6604","media_type":"application/vnd.spicy.bundle-tree+json","name":"release-records/fixtures/document-release-v2/invalid/segment-set-digest"},{"artifact_digest":"sha256:a97e70fa466893924fa07ea0e5404523d372f04c44a99e3ffca5487f18ae5ddd","media_type":"application/vnd.spicy.bundle-tree+json","name":"release-records/fixtures/document-release-v2/invalid/counts-mismatch"}],"record_type":"RulespecCoreRelease","release_digest":"sha256:ff444f8483a2bc7dfdee4169ef2014a9b5ac056fd08ba0dded0c1b9e60d6fe83","release_id":"urn:rulespec:core:ff444f8483a2bc7dfdee4169ef2014a9b5ac056fd08ba0dded0c1b9e60d6fe83","release_status":"candidate","schema_artifacts":[{"artifact_digest":"sha256:6fc03d564f250a9f875b70064edfb4e451f82fb618628f9c0dbe3c826daffe12","media_type":"application/schema+json","name":"release-records/schemas/document-release-v2.schema.json"},{"artifact_digest":"sha256:94baa999ee3db9fa6f1c66331691ca7423bf1aed90e4d94f9eeb46a3710d4e66","media_type":"application/schema+json","name":"release-records/schemas/document-release-v2/documents-v1.schema.json"},{"artifact_digest":"sha256:bf342695305b23501719e03e41b5d0de274b364260df466541f2f4826e6dcad7","media_type":"application/schema+json","name":"release-records/schemas/document-release-v2/member-manifest-v1.schema.json"},{"artifact_digest":"sha256:356399b34c9324a2327fe61c46c224cc9267904a4fb2cf9f44ef13bbc6c215db","media_type":"application/schema+json","name":"release-records/schemas/document-release-v2/search-segments-v1.schema.json"},{"artifact_digest":"sha256:85bed3a6127184a5b9bfdb07bba3489e2d6311f738269273e3ac543d020b75e4","media_type":"application/schema+json","name":"release-records/schemas/document-release-v2/source-dispositions-v1.schema.json"},{"artifact_digest":"sha256:d9ae6f283bd8181895728cc3501d795159fd638409e7d35131d66d6f30ab895c","media_type":"application/schema+json","name":"release-records/schemas/document-release-v2/structural-nodes-v1.schema.json"}],"validator_artifacts":[{"artifact_digest":"sha256:dbd4c45da4ad195c87ecc80a934236f33d6648713e11b395c340b4a3c5195733","media_type":"text/x-python","name":"src/rulespec_conformance/document_release.py"},{"artifact_digest":"sha256:91295d48511cb302cbd55d792fedccab7d355231a55e2194c581eae6bed0d6dc","media_type":"text/x-python","name":"src/rulespec_conformance/document_validate.py"}],"version":"2.0.0-candidate.1"}