{"conformance_fixture_artifacts":[{"artifact_digest":"sha256:0ed4a568e34ca90205b6561b42920322d282ca549071bc38d87c44562f6ab5d1","media_type":"application/vnd.spicy.bundle-tree+json","name":"release-records/fixtures/source-catalog-release-v1/valid"},{"artifact_digest":"sha256:f8944a92f1a063c718cbfc5325ed320988ddbb15dc4aebeec64974439fd74081","media_type":"application/vnd.spicy.bundle-tree+json","name":"release-records/fixtures/source-catalog-release-v1/invalid/noncanonical-root"},{"artifact_digest":"sha256:41d2f335daddd4bf46a91fbc8185aa785f850128b54ab34ccc860891641cae2d","media_type":"application/vnd.spicy.bundle-tree+json","name":"release-records/fixtures/source-catalog-release-v1/invalid/unknown-version"},{"artifact_digest":"sha256:3fb96ddf6c471b7ee7b8464b8eb6aa7c05164eb56096c66755260e33d54cc63f","media_type":"application/vnd.spicy.bundle-tree+json","name":"release-records/fixtures/source-catalog-release-v1/invalid/wrong-identity"},{"artifact_digest":"sha256:6e1251040252dd2e8b378b5ca0329f4d24e0a2b20b684db630fba876578828bb","media_type":"application/vnd.spicy.bundle-tree+json","name":"release-records/fixtures/source-catalog-release-v1/invalid/unsafe-path"},{"artifact_digest":"sha256:8ee42bb60ae0133ecc0ce20b9cd0f76e557d1ed195ec9f328a4bbf3c8b630d80","media_type":"application/vnd.spicy.bundle-tree+json","name":"release-records/fixtures/source-catalog-release-v1/invalid/missing-member"},{"artifact_digest":"sha256:a163de2e1c5a0f3aaa11e472f4dfc7b40ceb5263a3ff13f6e5612bc75fad6183","media_type":"application/vnd.spicy.bundle-tree+json","name":"release-records/fixtures/source-catalog-release-v1/invalid/extra-member"},{"artifact_digest":"sha256:f6ab315d52094f71becb5b0c10de06a87cbd90ce15cbf83ac4405cbc7d7f814a","media_type":"application/vnd.spicy.bundle-tree+json","name":"release-records/fixtures/source-catalog-release-v1/invalid/member-digest"},{"artifact_digest":"sha256:8b028bb175a7d33b692e48e9da9bb50144ac6fe438e2643bd7e90950c1d32c66","media_type":"application/vnd.spicy.bundle-tree+json","name":"release-records/fixtures/source-catalog-release-v1/invalid/missing-disposition"},{"artifact_digest":"sha256:8b22629d92ee1402da8f47468c816985f6befe49ad7e7249bc282a53664d55d8","media_type":"application/vnd.spicy.bundle-tree+json","name":"release-records/fixtures/source-catalog-release-v1/invalid/unknown-disposition"},{"artifact_digest":"sha256:788e340003f9e2d080f5bf039bfb1eec04e71f7926364c068d57d396199fb2e1","media_type":"application/vnd.spicy.bundle-tree+json","name":"release-records/fixtures/source-catalog-release-v1/invalid/missing-reason"},{"artifact_digest":"sha256:83019d5d91118bdfa9b49628b18355aa53f9acecba42b83dec78259521f95520","media_type":"application/vnd.spicy.bundle-tree+json","name":"release-records/fixtures/source-catalog-release-v1/invalid/duplicate-source-item"},{"artifact_digest":"sha256:53decc91491d5b5ebff408b140915dcca3b50a73c80bb679029c02fbcddef048","media_type":"application/vnd.spicy.bundle-tree+json","name":"release-records/fixtures/source-catalog-release-v1/invalid/set-digest-mismatch"},{"artifact_digest":"sha256:6acba2c8fed208ed29ed958efdc544f9adf777688d8ced6a61cba77b4ea51935","media_type":"application/vnd.spicy.bundle-tree+json","name":"release-records/fixtures/source-catalog-release-v1/invalid/selected-without-rendition"},{"artifact_digest":"sha256:103fd24645e034845287775530939af6a0fb66e861d79c9fce15a72c181b8f86","media_type":"application/vnd.spicy.bundle-tree+json","name":"release-records/fixtures/source-catalog-release-v1/invalid/refspec-concept-topic"},{"artifact_digest":"sha256:6e29e454148dc5567983576a7ce82087656337870eed86d572304f413d5108cc","media_type":"application/vnd.spicy.bundle-tree+json","name":"release-records/fixtures/source-catalog-release-v1/invalid/counts-mismatch"},{"artifact_digest":"sha256:5527ebebc9acdbc5a6ed525cbf49cd50a6a150a0cb0f52de4fbc5ff45ad4237d","media_type":"application/vnd.spicy.bundle-tree+json","name":"release-records/fixtures/source-catalog-release-v1/invalid/coverage-mismatch"}],"record_type":"RulespecCoreRelease","release_digest":"sha256:2de89ad867a3794cc1006ef4cd0301248d48a719b5cbab1946f62c2c30ac0ec5","release_id":"urn:rulespec:core:2de89ad867a3794cc1006ef4cd0301248d48a719b5cbab1946f62c2c30ac0ec5","release_status":"candidate","schema_artifacts":[{"artifact_digest":"sha256:1b7f0ccdefe52973db97fb145e3893a43bf4b12dcf00630a13af87a3486f4bbf","media_type":"application/schema+json","name":"release-records/schemas/source-catalog-release-v1.schema.json"},{"artifact_digest":"sha256:c22acd4d8d397d2bd790ee42fc7a44f93fccce3b8ae39e5e378967035b075d4c","media_type":"application/schema+json","name":"release-records/schemas/source-catalog-release-v1/member-manifest-v1.schema.json"},{"artifact_digest":"sha256:94c3953f0a615a94d3a6f6489d9095ab8882f82d677c1661a9b79d3642e90702","media_type":"application/schema+json","name":"release-records/schemas/source-catalog-release-v1/source-items-v1.schema.json"}],"validator_artifacts":[{"artifact_digest":"sha256:9bc49bf24c4b536ffe28ec8e0cb7650bae5419bfb35827f6b3e91a3fe41a4687","media_type":"text/x-python","name":"src/rulespec_conformance/source_catalog_release.py"},{"artifact_digest":"sha256:6209aed582a26aefd8b3d60bb1b47a1eacdf09ca528a20af9f86752f19f09654","media_type":"text/x-python","name":"src/rulespec_conformance/source_catalog_validate.py"}],"version":"1.0.0-candidate.1"}